1095,Sree Uthradam Thirunal Hospital Blood Bank,Kerala,THIRUVANANTHAPURAM,ThiruvAnanthapuram,695028,NULL,NULL,NULL,NULL,Private,NO,NO,24x7,01-09-1996,8.599623,76.969593
1096,Superior Blood Bank,Kerala,THIRUVANANTHAPURAM,Thiruvananthapuram,695001,NULL,NULL,Dr. P. Asokan,Medical Officer,Private,NO,NO,24x7,31-12-2012,8.4935113,76.9474123
1097,M/s. S R Super Speciality Hospital Blood Bank,Kerala,THIRUVANANTHAPURAM,Thiruvananthapuram,695318,9846348249,NULL,Ms. Saranya,Lab Technician,Private,YES,NO,24x7,20-02-2015,8.7081618,76.7316653
1098,S U T Royal Hospital Blood Bank,Kerala,THIRUVANANTHAPURAM,Trivandrum,695011,NULL,NULL,NULL,NULL,Private,YES,NO,24x7,09-10-2013,8.516322,76.940358
1099,M/s. Ruckmoni Memorial Devi Hospital Blood Bank,Kerala,THIRUVANANTHAPURAM,Trivandrum,695505,9809707939,rmdh2010@gmail.com,Dr. C. A. Mohan,Pathologist,Private,NO,NO,24x7,17-06-2015,8.4482986,77.127416
1100,Sree Gokulam Medical College and Research Foundation Blood Bank,Kerala,THIRUVANANTHAPURAM,Venjaramoodu,695607,NULL,NULL,NULL,NULL,Private,YES,NO,24x7,21-06-2005,8.692755,76.914675
1101,Thrissur Metropolitan Health Care Private Limited Blood Bank,Kerala,THRISSUR,na,680007,NULL,NULL,NULL,NULL,Private,NO,NO,24x7,17-05-2001,10.510405,76.21034
1102,Amala Cancer Hospital and Research Centre Blood Bank,Kerala,THRISSUR,Amalanagar,680555,NULL,NULL,NULL,NULL,Private,YES,NO,24x7,11-04-1997,10.561896,76.168745
1103,Saint James Hospital Blood Bank,Kerala,THRISSUR,Chalakkudy,680307,NULL,NULL,NULL,NULL,Private,NO,NO,24x7,17-04-1997,10.315567,76.335422
1104,Saint Josephs Hospital Blood Bank,Kerala,THRISSUR,Choondal,680502,8891191379,NULL,NULL,NULL,Private,NO,NO,24x7,05-05-1997,10.616859,76.094656
1105,Mary Immaculate Mission Hospital Blood Bank,Kerala,THRISSUR,Engandiyur,680615,NULL,NULL,NULL,NULL,Charity,NO,NO,24x7,29-03-2001,10.508889,76.057764
1106,Modern Medical Blood Bank,Kerala,THRISSUR,Kodungallur,680664,NULL,NULL,NULL,NULL,Private,NO,NO,24x7,30-03-2009,10.233898,76.194222
1107,Elite Mission Hospital Blood Bank,Kerala,THRISSUR,Koorkencherry,680007,NULL,NULL,NULL,NULL,Private,NO,NO,24x7,07-11-2010,10.502217,76.211028
1108,Royal Hospital Blood Bank,Kerala,THRISSUR,Kunnamkulam,680503,NULL,NULL,NULL,NULL,Private,NO,NO,24x7,09-09-1996,10.645883,76.067384
1109,Unity Hospital Private Limited Blood Bank,Kerala,THRISSUR,Kunnamkulam,680503,NULL,NULL,NULL,NULL,Private,NO,NO,24x7,31-12-1997,10.635746,76.081869
1110,Maria Theresa Hospital Blood Bank,Kerala,THRISSUR,Kuzhikkattusery,680696,NULL,NULL,NULL,NULL,Private,NO,NO,24x7,17-05-2001,10.289257,76.277178
1111,Medical College Hospital Blood Bank,Kerala,THRISSUR,Peringandoor,680581,9446372952,NULL,Dr. Pradeep Kumar,Medical Officer,Government,YES,NO,24x7,20-12-2005,10.630259,76.202424
1112,Mother Hospital Blood Bank,Kerala,THRISSUR,Pullazhi,680012,NULL,NULL,NULL,NULL,Private,NO,NO,24x7,17-04-1997,10.519157,76.185077
1113,Sacred Heart Mission Hospital Blood Bank,Kerala,THRISSUR,Pullur,680683,NULL,NULL,NULL,NULL,Charity,NO,NO,24x7,31-12-1998,10.349017,76.242118
1114,West Fort Hitech Hospital Blood Bank,Kerala,THRISSUR,Punkunnam,680002,NULL,NULL,NULL,NULL,Private,NO,NO,24x7,19-12-2003,10.536504,76.197029
1115,Janakeeya Samithy (Arogyam) I.M.A Blood Bank Complex and Research Centre ,Kerala,THRISSUR,Ramavarmapuram,680631,9947646464,NULL,DR. S. M. BALAGOPALAN,BLOOD BANK MEDICAL OFFICER IN-CHARGE,Charity,YES,NO,24x7,13-01-2004,10.559875,76.226818
1116,District Hospital Blood Bank ,Kerala,THRISSUR,Thrissur,680020,9446369015,NULL,Dr. Sreedevi,Medical Officer,Government,NO,NO,24x7,06-06-1995,10.522997,76.217675
1117,Aswini Hospital Private Limited Blood Bank,Kerala,THRISSUR,Thrissur,680022,NULL,NULL,NULL,NULL,Private,NO,NO,24x7,14-01-1999,10.534768,76.214142
1118,Bishop Alappat Mission Hospital Blood Bank,Kerala,THRISSUR,Thrissur,680702,NULL,NULL,NULL,NULL,Private,NO,NO,24x7,05-02-1997,10.395236,76.164596
1119,Jubilee Mission Hospital Blood Bank,Kerala,THRISSUR,Thrissur,680005,NULL,NULL,NULL,NULL,Private,YES,NO,24x7,24-01-2011,10.520189,76.227996
1120,Malankara Orthodox Syrian Church Medical Mission Hospital Blood Bank,Kerala,THRISSUR,Thrissur,680503,NULL,NULL,NULL,NULL,Charity,YES,NO,24x7,15-11-2007,9.983303,76.474382
1121,Thrichur Heart Hospital Limited Blood Bank,Kerala,THRISSUR,Thrissur,680021,NULL,NULL,NULL,NULL,Private,YES,NO,24x7,24-01-2011,10.512613,76.214571
1122,West Fort Hospital Blood Bank Thrissur,Kerala,THRISSUR,Thrissur,680004,NULL,NULL,NULL,NULL,Private,NO,NO,24x7,10-04-2002,10.524176,76.201807
1123,M/s. Ahalia International Foundation Blood Bank,Kerala,THRISSUR,Thrissur,678557,9495191387,bloodbankahalia@ahkv.org,Ms. Babitha,Lab Technician,Private,YES,NO,24x7,21-04-2015,10.8217479,75.8820596
1124,M/s. Leo Hospital Blood Bank,Kerala,WAYAnaD,Kalpetta,673121,9447368639,NULL,Dr. T. P. V. Surendran,NULL,Private,NO,NO,24x7,12-12-2013,11.604557,76.085057
1125,District Hospital Blood Bank,Kerala,WAYAnaD,Manathavady,670645,9947793272,bloodbankmntdy@gmail.com,Dr. Binija Merin Joy,Medical Officer,Government,YES,NO,24x7,13-12-1997,11.800634,76.001923
1126,D. M. Wayanad Institute of Medical Sciences Blood Bank,Kerala,WAYAnaD,Meppadi,673577,NULL,NULL,NULL,NULL,Private,NO,NO,24x7,20-03-2013,11.559371,76.160491
1127,Government Taluk Head Quarters Hospital Blood Bank,Kerala,WAYAnaD,Sulthan Bathery,673592,9447011005,NULL,Dr. Suraj,Medical Officer,Government,NO,NO,24x7,31-07-2001,11.662543,76.257414
1128,Indira Gandhi Hospital Blood Bank,Lakshadweep,LAKSHADWEEP DISTRICT,Lakshadweep,NULL,NULL,NULL,NULL,NULL,Government,NULL,NULL,NULL,NULL,0,0
1129,District Hospital Blood Bank,Madhya Pradesh,ALIRAJPUR,Alirajpur,NULL,9424063134,NULL,Dr. B. K.  Sahu,MD (Pathology) & Certificate  Course in Blood Transfusion,Government,NO,NO,24x7,28-02-2009,22.184448,74.211956
1130,Ashoknagar Seva Samiti Blood Bank,Madhya Pradesh,ASHOKnaGAR,Ashoknagar,473331,9826599122,NULL,Dr. SoNULLli Bhonsle,"MBBS, DPB",Private,NO,NO,24x7,27-07-2011,18.510632,73.816224
1131,District Hospital Balaghat,Madhya Pradesh,BALAGHAT,Balaghat,481001,0982716xxxx,raktakoshbgt@gmail.com,Dr. A. K. Jain,MD (Pathology),Government,NO,NO,24x7,01-01-1987,21.818351,80.182799
1132,Agrawal Blood Bank,Madhya Pradesh,BALAGHAT,Balaghat,481001,NULL,NULL,Dr. Jagdish Agrawal,MBBS,Private,NO,NO,24x7,14-07-2003,21.816763,80.189731
1133,District Hospital Blood Bank,Madhya Pradesh,BARWANI,Barwani,451551,9993348333,NULL,Dr. Aseem Roy,MBBS,Government,NO,NO,24x7,01-01-2013,22.02134,74.541084
1134,District Hospital Blood Bank,Madhya Pradesh,BETUL,Betul,460001,9425002915,NULL,Dr. Ashok Baranga,"MBBS, DCP",Government,NO,NO,24x7,01-01-2008,21.903381,77.898085
1135,Padhar Hospital Blood Bank,Madhya Pradesh,BETUL,Padhar,460005,NULL,NULL,NULL,NULL,Private,NO,NULL,NULL,NULL,22.055189,77.86498
1136,WCL Hospital Blood Bank Pathakheda ,Madhya Pradesh,BETUL,Pathakheda ,460447,9425636992,NULL,NULL,NULL,NULL,NULL,NULL,24x7,NULL,22.125155,78.142296
1137,District Hospital Blood Bank,Madhya Pradesh,BHIND,Bhind,477001,9977664494,NULL,Dr. Harendra Singh,"MBBS, DCP",Government,NO,NO,24x7,06-12-2008,26.566008,78.782684
1138,Chirayu Medical College and Hospital Blood Bank,Madhya Pradesh,BHOPAL,Bairagarh,462030,776679132,NULL,Dr. Amit Haritwal,MD (Pathology),Private,YES,NO,24x7,03-02-2011,23.268916,77.308073
1139,Gandhi Medical College Blood Bank,Madhya Pradesh,BHOPAL,Bhopal,462001,9425010647,NULL,Dr. U. M. Sharma,MD (Pathology),Government,YES,YES,24x7,01-01-2013,23.259924,77.390958
1140,Bhopal Memorial Hospital and Research Centre Blood Bank,Madhya Pradesh,BHOPAL,Bhopal,462038,9425012342,bloodbank.bmhrc@gmail.com,Dr. Manisha Shrivastava,MD (Immuno Haematology & Blood Transfusion - Transfusion Medicine),Government,YES,YES,24x7,27-11-2000,23.18006,77.25035
1141,District Hospital Blood Bank,Madhya Pradesh,BHOPAL,Bhopal,482016,9827056443,NULL,NULL,NULL,NULL,NULL,NULL,24x7,NULL,23.229861,77.417539
1142,IGH Gas Rahat Blood Bank,Madhya Pradesh,BHOPAL,Bhopal,462002,9425013686,NULL,Dr. Nisha Shrivastava,MD (Pathology),Government,NO,NO,24x7,18-11-2004,23.1549,77.244677
1143,Indian Red7091 Cross Society (IRCS) Blood Bank,Madhya Pradesh,BHOPAL,Bhopal,462016,9303132652,NULL,Dr. O.P. Shrivastava,MD (Pathology & Microbiology),Private,NO,NO,24x7,18-12-2014,23.2307,77.419553
1144,Kasturba Hospital BHEL Blood Bank,Madhya Pradesh,BHOPAL,Bhopal,462020,NULL,NULL,Dr. Nutan Hemrom,MBBS,Government,NO,NO,24x7,01-05-1992,23.222946,77.446666
1145,MP Thelasmia Kid Care Society Blood Bank,Madhya Pradesh,BHOPAL,Bhopal,462001,9827267821,NULL,Dr. Raja Maity,"MBBS, DCP",Private,YES,NO,24x7,13-11-2002,23.2582415,77.3952417
1146,Tatpar Pathology and Diagnostic Centre Blood Bank,Madhya Pradesh,BHOPAL,Bhopal,462008,9826066913,NULL,Dr. Tarun Kumar Rajput,"MBBS, DCP",Private,YES,NO,24x7,28-09-1992,23.25369,77.412695
1147,Jawahar Lal Nehru Cancer Hospital and Research Centre Blood Bank,Madhya Pradesh,BHOPAL,Bhopal,462003,9425431974,NULL,Dr. Ritu Singhal,MD (Pathology),Private,YES,NO,24x7,24-01-2001,23.273077,77.380764
1148,People Hospital Blood Bank,Madhya Pradesh,BHOPAL,Bhopal,462038,NULL,NULL,Dr. Ajit Saluja,MD (Pathology),Private,YES,NO,24x7,30-08-2011,23.301078,77.424616
1149,New Bhopal Blood Bank,Madhya Pradesh,BHOPAL,Bhopal,462016,NULL,NULL,Dr. Arun Maity,MD (Pathology),Private,NO,NO,24x7,28-04-2001,23.20973,77.437187
1150,Arpan Blood Bank,Madhya Pradesh,BHOPAL,Bhopal,462011,NULL,NULL,Dr. N. K. Pehlajani,MD (Pathology),Private,NO,NO,24x7,31-03-2006,23.2289768,77.4351847
1151,Chirayu Health and Medicare Blood Bank ,Madhya Pradesh,BHOPAL,Bhopal,462001,NULL,NULL,Dr. Samir Singh,MD (Pathology),Private,YES,YES,24x7,28-04-2006,23.258167,77.39707
1152,City Blood Bank of Bhojpal Charitable Trust,Madhya Pradesh,BHOPAL,Bhopal,462046,9425438695,lbs_hospital@rediffmail.com,Dr. B. K. Shrivastava,"MBBS, DA",Private,NO,NO,24x7,05-04-2007,23.26,77.412
1153,JK Hospital and Medical Research Centre Blood Bank,Madhya Pradesh,BHOPAL,Bhopal,462042,NULL,NULL,Dr. Vivek Khare,MD (Pathology),Private,YES,YES,24x7,31-07-2009,23.178855,77.428807
1154,Manas Blood Bank of Chinmayi Swasthya Seva Sadhbhav Shikshan Samiti,Madhya Pradesh,BHOPAL,Bhopal,462001,9993914499,NULL,Dr. S. K. Shrivastava,MD (Medicine) ,Private,YES,NO,24x7,28-06-2010,23.26,77.39
1155,RKDF Medical College Hospital and Research Centre Blood Bank,Madhya Pradesh,BHOPAL,Bhopal,462026,NULL,NULL,NULL,NULL,NULL,NULL,NULL,NULL,NULL,0,0
1156,Bansal Hospital Redefining Healthcare Blood Bank,Madhya Pradesh,BHOPAL,Bhopal,462016,7898301792,NULL,Dr. NULLmita Choudhary,MD (Pathology),Private,YES,NO,24x7,31-01-2014,23.199485,77.420061
1157,District Hospital,Madhya Pradesh,BURHANPUR,Burhanpur,450331,9754876365,humaddawood@gmail.com,Dr. Humayoun S Dawood,MBBS DCP,Government,NO,NO,24X7,07-12-2012,21.204824,76.114212
1158,Chandubhai Somabhai Patel Blood Bank ,Madhya Pradesh,BURHANPUR,Burhanpur,450331,NULL,NULL,Dr. R. C. Dalal,"MBBS, DCP",Charity,NO,NO,24x7,03-12-2003,21.304,76.224
1159,District Hospital Blood Bank,Madhya Pradesh,CHHATARPUR,Chhatarpur,471001,9826862507,NULL,Dr. N. K. BarsaNULL,MD (Pathology),Government,NO,NO,24x7,01-01-2002,24.90762,79.584212
1160,WCL Badkui Hospital Chhindwara Blood Bank,Madhya Pradesh,CHHINDWARA,Barkui,480447,9425461226,NULL,Dr. P. Roy,"MBBS, DCP",Government,NO,NO,24x7,21-03-1990,22.113513,78.430952
1161,District Hospital Blood Bank,Madhya Pradesh,CHHINDWARA,Chhindwara,480001,9425832530,NULL,Dr. R. Tandekar,MD (Pathology),Government,YES,NO,24x7,14-08-1996,22.052641,78.937218
1162,District Hospital Blood Bank,Madhya Pradesh,DAMOH,Damoh,470661,"09425406173, 09893523216",NULL,Dr. P. C. Swarnkar,MD (Pathology),Government,NO,NO,24x7,01-01-2002,23.833141,79.440745
1163,Madhav Smriti Seva Nyas Blood Bank,Madhya Pradesh,DAMOH,Damoh,470661,NULL,NULL,NULL,NULL,NULL,NULL,NULL,NULL,NULL,0,0
1164,District Hospital Blood Bank,Madhya Pradesh,DATIA,Datia,475661,9826235557,NULL,Dr. Jay Bharat Singh,MD (Pathology),Government,NO,NO,24x7,19-12-2008,25.687237,78.442216
1165,District Hospital Blood Bank,Madhya Pradesh,DEWAS,Dewas,455001,9826336991,NULL,Dr. A. K. Bidwai,"MBBS, DCP",Government,NO,NO,24x7,13-12-1996,22.962207,76.048075
1166,Vishnuprabha Charitable Trust Blood Bank,Madhya Pradesh,DEWAS,Dewas,455001,9827030999,vishnuprabha1@yahoo.co.in,Dr. G. P. Bhagwat,MD (Pathology),Charity,NO,NO,24x7,02-02-2011,22.964817,76.046337
1167,District Hospital Blood Bank ,Madhya Pradesh,DHAR,Dhar,454001,9424004170,dranilverma@gmail.com,Dr. Anil Verma,MD (Pathology),Government,NO,NO,24x7,01-01-2006,22.594249,75.308054
1168,Mittal Hospital Blood Bank,Madhya Pradesh,DHAR,Dhar,454001,7771015777,mmch.dhar@rediffmail.com,Dr. Pratik Mittal,"MBBS, DCP ",Private,NO,NO,24x7,NULL,22.595954,75.299087
1169,District Hospital Blood Bank,Madhya Pradesh,DINDORI,Dindori,481880,9425165535,NULL,Dr. B. P. Kole,"MBBS, DCP",Government,NO,NO,24x7,10-10-2013,22.946033,81.075282
1170,District Hospital Blood Bank,Madhya Pradesh,EAST NIMAR,Khandwa,450001,9425070592,artkhandwa@gmail.com,Dr. Atul Mane,MD (Pathology),Government,NO,NO,24x7,13-01-1998,21.824535,76.343016
1171,Deep Blood Bank,Madhya Pradesh,EAST NIMAR,Khandwa,450001,NULL,NULL,NULL,NULL,NULL,NULL,NULL,NULL,NULL,22.8740505,74.7337069
1172,District Hospital Blood Bank,Madhya Pradesh,GUNA,Guna,473001,9630195174,NULL,Dr. Dhakad,"MBBS, DCP",Government,NO,NO,24x7,19-06-1905,24.646947,77.308376
1173,Kanchan Medicare and Research Centre Private Limited Blood Bank,Madhya Pradesh,GUNA,Guna,473001,"09407200900, 09977378690",kmrcguNULL@gmail.com,Dr. G. K. Sharma,MD (Paediatrics),Private,NO,NO,24x7,08-02-2000,24.648661,77.302928
1174,Indian Red Cross Society (IRCS) Blood Bank,Madhya Pradesh,GWALIOR,Dabra,475110,NULL,NULL,Dr,NULL,Private,NO,NO,24x7,21-07-2000,25.531751,78.200319
1175, Blood Bank (Component & Apheresis Unit) G.R.Medical College,Madhya Pradesh,GWALIOR,Gwalior,474009,9425111202,NULL,Dr. Dharmesh Chandra Sharma,MD (Pathology) & Certificate  Course In Blood Transfusion,Government,YES,YES,24x7,01-01-2012,26.192166,78.164638
1176,District Hospital Blood Bank,Madhya Pradesh,GWALIOR,Gwalior,474006,9826351516,NULL,Dr. Verma,MD (Pathology),Government,NO,NO,24x7,29-11-2006,26.225961,78.222716
1177,Indian Red Cross Society (IRCS) Blood Bank,Madhya Pradesh,GWALIOR,Gwalior,474001,"09329767276, 09893972654",indianredcross.4@gmail.com,Dr. P. M. Bhan,"MBBS, DCP",Charity,NO,NO,24x7,08-08-1991,26.191826,78.159549
1178,Shri Radheswami Blood Bank,Madhya Pradesh,GWALIOR,Gwalior,474009,9826501162,NULL,Dr. B. K. Singhal,MD (Pathology),Private,NO,NO,NULL,11-11-1998,26.195391,78.158556
1179,Emergency Blood Bank,Madhya Pradesh,GWALIOR,Gwalior,474009,9893417222,a_sao@hotmail.com,Dr. Satya Sao,MD (Pathology),Private,YES,NO,24x7,26-07-1975,26.191025,78.155889
1180,Captain OS Dewan Memorial Blood Bank,Madhya Pradesh,GWALIOR,Gwalior,474001,NULL,NULL,NULL,NULL,NULL,NULL,NULL,NULL,NULL,0,0
1181,Cancer Hospital and Research Centre Blood Bank,Madhya Pradesh,GWALIOR,Gwalior,474009,NULL,NULL,NULL,NULL,NULL,NULL,NULL,NULL,NULL,0,0
1182,Radhaswami Blood Bank Services,Madhya Pradesh,GWALIOR,Gwalior,474001,NULL,NULL,NULL,NULL,NULL,NULL,NULL,NULL,NULL,0,0
1183,Shri Guruji Raktkosh Blood Bank,Madhya Pradesh,GWALIOR,Gwalior,474001,NULL,NULL,NULL,NULL,NULL,NULL,NULL,NULL,NULL,0,0
1184,Birla Institute of Medical Research Blood Bank,Madhya Pradesh,GWALIOR,Gwalior,474006,NULL,NULL,NULL,NULL,NULL,NULL,NULL,NULL,NULL,0,0
1185,District Hospital Blood Bank,Madhya Pradesh,HARDA,Harda,461331,9425981771,NULL,Dr. Ruby Khan,"MBBS, DCP",Government,NO,NO,24x7,07-05-2012,22.340634,77.093043
1186,District Hospital Blood Bank,Madhya Pradesh,HOSHANGABAD,Hoshangabad,461001,9425041911,bloodbankhbad@gmail.com,Dr. Dinesh Yadav,MD (Pathology),Government,NO,NO,24x7,28-04-1998,22.452716,77.430707
1187,Society of Saint Joseph Hospital Blood Bank,Madhya Pradesh,HOSHANGABAD,Hoshangabad,461001,NULL,NULL,NULL,NULL,NULL,NULL,NULL,NULL,NULL,0,0
1188,Harit Blood Bank,Madhya Pradesh,HOSHANGABAD,Hoshangabad,461001,NULL,NULL,NULL,NULL,NULL,NULL,NULL,NULL,NULL,0,0
1189,Shreya Blood Bank,Madhya Pradesh,HOSHANGABAD,Hoshangabad,461001,NULL,NULL,NULL,NULL,NULL,NULL,NULL,NULL,NULL,0,0
1190,Civil Hospital Itarsi Blood Bank,Madhya Pradesh,HOSHANGABAD,Itarsi,461111,9425041911,NULL,Dr. Dinesh Yadav,MD (Pathology),Government,NO,NO,24x7,21-06-1905,22.361975,77.451276
1191,Lahoti Medicare Private Limited Blood Bank,Madhya Pradesh,INDORE, Indore ,NULL,NULL,NULL,NULL,NULL,Private,NULL,NULL,NULL,NULL,0,0
1192,MY Hospital & MGM Medical College - State of ART Model Blood Bank ,Madhya Pradesh,INDORE,Indore,452001,9893273236,modelbloodbankmyh@gmail.com,Dr. Ashok Yadav ,MD (Pathology),Government,YES,YES,24x7,18-06-1905,22.714476,75.882875
1193,Modern Blood Bank,Madhya Pradesh,INDORE,Indore,453441,9826064696,NULL,NULL,NULL,NULL,NULL,NULL,NULL,NULL,0,0
1194,Allied Pathology Laboratory and Blood Bank,Madhya Pradesh,INDORE,Indore,452010,NULL,NULL,NULL,NULL,NULL,NULL,NULL,NULL,NULL,0,0
1195,CHL Apollo Hospital Blood Bank,Madhya Pradesh,INDORE,Indore,452010,NULL,NULL,NULL,NULL,NULL,NULL,NULL,NULL,NULL,0,0
1196,Suyash Blood Bank,Madhya Pradesh,INDORE,Indore,452001,NULL,NULL,NULL,NULL,NULL,NULL,NULL,NULL,NULL,0,0
1197,Mohit Blood Bank Services,Madhya Pradesh,INDORE,Indore,452010,NULL,NULL,NULL,NULL,NULL,NULL,NULL,NULL,NULL,0,0
1198,Lions Club of Indore Blood Bank,Madhya Pradesh,INDORE,Indore,452002,NULL,NULL,NULL,NULL,NULL,NULL,NULL,NULL,NULL,0,0
1199,MP Thalassmia Welfare Society Blood Bank,Madhya Pradesh,INDORE,Indore,452008,NULL,NULL,NULL,NULL,NULL,NULL,NULL,NULL,NULL,0,0
1200,Shubham Pathological Diagnostic Centre Blood Bank,Madhya Pradesh,INDORE,Indore,452001,NULL,NULL,NULL,NULL,NULL,NULL,NULL,NULL,NULL,0,0
1201,Life Line Hospital Blood Bank,Madhya Pradesh,INDORE,Indore,452010,NULL,NULL,NULL,NULL,NULL,NULL,NULL,NULL,NULL,0,0
1202,Qurewell Blood Bank of Care Well Hospital Private Limited,Madhya Pradesh,INDORE,Indore,452001,NULL,NULL,NULL,NULL,NULL,NULL,NULL,NULL,NULL,0,0
1203,Noble Pathology Labs Blood Bank,Madhya Pradesh,INDORE,Indore,452001,NULL,NULL,NULL,NULL,NULL,NULL,NULL,NULL,NULL,0,0
1204,Shri Satya Sai Blood Bank,Madhya Pradesh,INDORE,Indore,452016,NULL,NULL,NULL,NULL,NULL,NULL,NULL,NULL,NULL,0,0
1205,Shri Indore Cloth Market Hospital Blood Bank,Madhya Pradesh,INDORE,Indore,452017,NULL,NULL,NULL,NULL,NULL,NULL,NULL,NULL,NULL,0,0
1206,Vishnu Prabha Diagnostic Centre Blood Bank,Madhya Pradesh,INDORE,Indore,452001,"09827030999, 09827351240",NULL,NULL,NULL,NULL,NULL,NULL,NULL,NULL,0,0
1207,Choitram Hospital and Research Centre Blood Bank,Madhya Pradesh,INDORE,Indore,452014,NULL,NULL,NULL,NULL,NULL,NULL,NULL,NULL,NULL,0,0
1208,Vishesh Hospital Blood Bank,Madhya Pradesh,INDORE,Indore,452001,NULL,NULL,NULL,NULL,NULL,NULL,NULL,NULL,NULL,22.7187135,75.8882735
1209,Gurjar Hospital and Endoscopy Centre Private Limited Blood Bank,Madhya Pradesh,INDORE,Indore,452009,9993172869,NULL,NULL,NULL,NULL,NULL,NULL,NULL,NULL,22.691901,75.866108
1210,Gokuldas Hospital Blood Bank,Madhya Pradesh,INDORE,Indore,452001,9826077557,NULL,NULL,NULL,NULL,NULL,NULL,NULL,NULL,22.716411,75.8760433
1211,SNG Hospital Blood Bank,Madhya Pradesh,INDORE,Indore,452001,9826379533,NULL,NULL,NULL,NULL,NULL,NULL,NULL,NULL,22.720246,75.8817
1212,Index Medical College Hospital and Research Centre Blood Bank,Madhya Pradesh,INDORE,Indore,462008,9752538454,NULL,NULL,NULL,NULL,NULL,NULL,NULL,NULL,22.732016,75.888857
1213,Arihant Hospital and Research Centre Blood Bank,Madhya Pradesh,INDORE,Indore,452009,NULL,NULL,NULL,NULL,NULL,NULL,NULL,NULL,NULL,22.701662,75.829585
1214,Aruvindo Blood Banks SAIMS Hospital,Madhya Pradesh,INDORE,Indore,453555,NULL,NULL,NULL,NULL,NULL,NULL,NULL,NULL,NULL,22.796953,75.845156
1215,Bombay Hospital Trust Blood Bank,Madhya Pradesh,INDORE,Indore,452010,NULL,NULL,NULL,NULL,NULL,NULL,NULL,NULL,NULL,22.71957,75.857726
1216,Greater Kailash Hospitals Private Limited Blood Bank,Madhya Pradesh,INDORE,Indore,452018,9977220606,NULL,NULL,NULL,NULL,NULL,NULL,NULL,NULL,22.72527,75.889633
1217,Sanghvi Blood Bank,Madhya Pradesh,INDORE,Indore,452001,NULL,NULL,NULL,NULL,NULL,NULL,NULL,NULL,NULL,22.7166872,75.8739793
1218,Verma Union Hospital Blood Bank,Madhya Pradesh,INDORE,Indore,452002,NULL,NULL,NULL,NULL,NULL,NULL,NULL,NULL,NULL,22.71209,75.838098
1219,NSCB Medical College Blood Bank,Madhya Pradesh,JABALPUR,Jabalpur,482003,8989821487,transfusionmedicinejbp@gmail.com,Dr. L. K. Patel,MD (Pathology),Government,YES,YES,24x7,01-01-2013,23.149881,79.881151
1220,Rani Durgawati Hospital Blood Bank,Madhya Pradesh,JABALPUR,Jabalpur,482001,9826319646,NULL,NULL,NULL,NULL,NULL,NULL,24x7,NULL,23.100428,79.565702
1221,District Victoria Hospital Blood Bank,Madhya Pradesh,JABALPUR,Jabalpur,482002,9424957288,NULL,Dr. Nikhil Dubey,MD(Pathology),Government,NO,YES,24x7,31-03-1997,23.172743,79.936409
1222,Bansal Blood Bank and Transfusion Service,Madhya Pradesh,JABALPUR,Jabalpur,482002,NULL,NULL,NULL,NULL,NULL,NULL,NULL,NULL,NULL,23.164273,79.929699
1223,Jabalpur Thalesemia Society Blood Bank,Madhya Pradesh,JABALPUR,Jabalpur,482002,9301338741,NULL,NULL,NULL,NULL,NULL,NULL,NULL,NULL,23.169545,79.932327
1224,Khanna Pathology Lab and Blood Bank,Madhya Pradesh,JABALPUR,Jabalpur,482002,NULL,NULL,NULL,NULL,NULL,NULL,NULL,NULL,NULL,23.1708138,79.9304742
1225,Military Hospital Blood Bank ,Madhya Pradesh,JABALPUR,Jabalpur,482001,NULL,NULL,NULL,NULL,NULL,NULL,NULL,NULL,NULL,23.1496957,79.9530199
1226,Jabalpur Blood Bank & Pathology Lab,Madhya Pradesh,JABALPUR,Jabalpur,NULL,NULL,NULL,NULL,NULL,Private,NULL,NULL,NULL,NULL,0,0
1227,District Hospital,Madhya Pradesh,JHABUA,Jhabua,457661,9826175322,NULL,DR. R.G Koushal,MBBS. M D,Government,NO,NULL,24X7,01-01-2013,22.773068,74.591422
1228,Jivan Jyoti Hospital Blood Bank,Madhya Pradesh,JHABUA,Meghnagar,457779,9425945142,NULL,NULL,NULL,NULL,NULL,NULL,NULL,NULL,22.913396,74.53969
1229,District Hospital Blood Bank,Madhya Pradesh,KATNI,Katni,483501,9425183356,NULL,Dr. Sudha NULLmdev,MD (Pathology),Government,NO,NO,24x7,28-10-2005,23.832575,80.39196
1230,District Hospital Blood Bank,Madhya Pradesh,KHARGONE,Khargone,451001,9425496084,NULL,Dr. Ratnesh Mahajan ,NULL,Government,NO,NULL,24x7,NULL,21.831932,75.628611
1231,District Hospital Blood Bank Mandla,Madhya Pradesh,MANDLA,Mandla,481661,9425163929,bloodbank_mandla@rediffmail.com,Dr. Gourav Jetly,"MBBS, M.S.",Government,NO,NO,24x7,13-02-1997,22.596278,80.370388
1232,District Hospital Blood Bank,Madhya Pradesh,MANDSAUR,Mandsaur,458001,9407101767,bbdhmds@gmail.com,Dr. Saurabh Mandwaria,"MBBS, DCP",Government,NO,NO,24x7,19-06-1905,24.069241,75.071826
1233,Jain Pathology Laboratory and Blood Bank,Madhya Pradesh,MANDSAUR,Mandsaur,458001,9827070408,NULL,NULL,NULL,NULL,NULL,NULL,NULL,NULL,24.5550033,75.1727662
1234,District Hospital Blood Bank,Madhya Pradesh,MOREna,Morena,476001,9826246293,bloodbankmoreNULL@gmail.com,Dr. Rakesh Upadhyaya,MD (Pathology),Government,NO,NO,24x7,07-06-1997,26.496004,77.998665
1235,Jindal Blood Bank,Madhya Pradesh,MOREna,Morena,476001,9425126999,NULL,NULL,NULL,NULL,NULL,NULL,NULL,NULL,26.7048053,78.2265252
1236,District Hospital narsinghpur Blood Bank ,Madhya Pradesh,naRSINGHPUR,narsinghpur,487001,9407304896,NULL,Dr. Rakesh Sagariya,MD (Pathology),Government,NO,NO,24x7,24-02-1997,22.565735,79.110807
1237,Indian Red Cross Society (IRCS) Blood Bank,Madhya Pradesh,NEEMUCH,Neemuch,458441,9406612591,redcrossbbnmh@gmail.com,Dr. D. S. Choudhary,MD (Pathology),Government,NO,NO,24x7,01-01-2005,24.460273,74.874825
1238,District Hospital Blood Bank,Madhya Pradesh,PANna,Panna,488001,9424350011,NULL,NULL,"MBBS, DCP ",NULL,NULL,NULL,24x7,NULL,24.712076,80.181218
1239,District Hospital Blood Bank,Madhya Pradesh,RAISEN,Raisen,464551,9425652351,NULL,NULL,NULL,NULL,NULL,NULL,24x7,NULL,23.333493,77.78043
1240,District Hospital Blood Bank,Madhya Pradesh,RAJGARH,Rajgarh,465661,9179375278,csurgeonrajmp@mp.nic.in,Dr. P. K. Jain,MD (Pathology),Government,NO,NO,24x7,27-06-2003,24.00976,76.732073
1241,District Hospital Blood Bank,Madhya Pradesh,RATLAM,Ratlam,457001,"07879154365, 09827232032",bloodbankrtm@gmail.com,Dr. Shailendra Solanki,MD (Pathology),Government,NO,YES,24x7,19-09-1997,23.327397,75.038845
1242,Manav Seva Samiti Blood Bank,Madhya Pradesh,RATLAM,Ratlam,457001,9039494095,NULL,NULL,NULL,NULL,NULL,NULL,NULL,NULL,23.3266577,75.039959
1243,S. S. Medical College Blood Bank,Madhya Pradesh,REWA,Rewa,486001,"09827583242, 09755461008",NULL,Dr. Santosh Singh,MD (Pathology),Government,YES,NO,24x7,20-12-1996,24.531793,81.299794
1244,District Hospital Blood Bank,Madhya Pradesh,SAGAR,Sagar,470001,9827245793,bloodbankndhsagar@gmail.com,Dr. R. K. Dixit,MD (Pathology),Government,NO,NO,24x7,21-12-1994,23.492157,78.451821
1245,Bhagyoday Tirth Hospital Blood Bank,Madhya Pradesh,SAGAR,Sagar,470002,NULL,NULL,NULL,NULL,NULL,NULL,NULL,NULL,NULL,23.851061,78.722466
1246,Sadguru Blood Bank Chitrakoot,Madhya Pradesh,SATna,Chitrakoot,485001,9935207959,slabs@sadgurutrust.org,Dr. ABS Rajput,"MBBS, DCP",Private,NO,NO,24x7,01-07-2009,25.095043,80.515971
1247,District Hospital Blood Bank,Madhya Pradesh,SATna,Satna,485001,9893738846,NULL,NULL,NULL,NULL,NULL,NULL,24x7,NULL,24.567945,80.832069
1248,MP Birla Hospital and Priyamvada Birla Cancer Research Institute Blood Bank,Madhya Pradesh,SATna,Satna,485005,"08224003814, 08224003804",NULL,NULL,NULL,NULL,NULL,NULL,NULL,NULL,24.585065,80.85646
1249,District Hospital Blood Bank,Madhya Pradesh,SEHORE,Sehore,466001,9425650196,NULL,Dr. P. S. Armo,MD (Pathology),Government,NO,NO,24x7,01-11-2001,23.198387,77.081271
1250,District Hospital Blood Bank Seoni,Madhya Pradesh,SEONI,Seoni,480661,9827267407,bbseoni@gmail.com,S.N.Gupta LT,MD (Pathology),Government,NO,NO,24x7,01-02-1997,22.054391,79.330324
1251,Burhar Central Hospital of South Eastern Coal Fields Limited Blood Bank,Madhya Pradesh,SHAHDOL,Dhanpuri,484114,9425890427,NULL,Dr. Sangita Tiwari,MD (Pathology),Government,NO,NO,24x7,30-09-2006,23.185907,81.571377
